{
  "schema_version": 1,
  "id": "illuminate.tidy-doc",
  "version": "1.0.0",
  "entry": "SKILL.md",

  "activation": {
    "mode": "auto",
    "include_tags": [
      "documentation.cleanup",
      "documentation.align",
      "index.fix",
      "stale-reference.fix"
    ],
    "exclude_tags": []
  },

  "requirements": {
    "required_artifacts": [],
    "preferred_artifacts": [],
    "commands": [
      "git",
      "grep"
    ]
  },

  "permissions": {
    "read": [
      "repository/**"
    ],
    "write": [
      "repository/**"
    ],
    "execute": [
      "grep",
      "rg"
    ]
  },

  "relations": {
    "recommended_next": [],
    "conflicts_with": []
  },

  "outputs": [
    "tidied_documents",
    "misleading_issues_fixed",
    "remaining_residue_report"
  ]
}
